,企業名,キャッチコピー,ステータス,初年度年収
0,ゼネリックソリューション株式会社 | 【100％自社内開発】第二新卒・ポテンシャル採用も可能！,【ソフトウェアエンジニア】開発経験あればOK/年収800万円も可！ 正社員,正社員,400万円～800万円
1,富国生命保険相互会社 | 経営安定、待遇・福利厚生充実の企業が中途採用を実施！,未経験OK！【営業総合職（営業所長候補）】年休121日／賞与4カ月 正社員,正社員,350万円～650万円
2,株式会社マイスターエンジニアリング | ゼロから先端産業のエンジニアへ / 地域限定正社員募集！,経験ゼロからでOK【エンジニア地域限定総合職】年間休日121日 正社員,正社員,
3,ジンマー・バイオメット合同会社 | 専門性の高い医療知識が身に付く／自宅が拠点の直行直帰スタイル,世界トップクラスのシェアを誇る【医療機器営業】教育研修あり 正社員,正社員,370万円～670万円
4,アプライド マテリアルズ ジャパン株式会社 | 売上世界No.1の半導体製造装置メーカーの日本法人,全国募集【エンジニア・技術職】未経験歓迎◆高卒以上◆35歳以下 正社員,正社員,
5,ブリヂストンタイヤソリューションジャパン株式会社 | 成長×安定／「個」の成長にもフォーカスした職場です！,【企画営業】世界トップシェアの商材を扱い営業として活躍！ 正社員,正社員,300万円～450万円
6,中京広告株式会社 | 《2007年設立＊成長中企業》いろんな事にチャレンジできる環境,資格取得もOK！スキルを磨ける【WEBマーケター】★年休120日以上 正社員,正社員,
7,株式会社NEXT STORIES | ★入社祝金10万円★平均年収720万円※大阪府緊急雇用対策に賛同,【アフターフォロー営業】★月給30万～&完休2日★WEB面接OK 正社員,正社員,600万円～700万円
8,住友不動産株式会社 | 東証プライム上場◆平均残業時間18時間◆転勤なし◆完全週休二日,第二新卒歓迎◆最高年収実績1100万円【新築分譲マンション営業】 正社員,正社員,400万円～500万円
9,株式会社アヴァンザ | 【研修制度充実】賞与年2回／在宅9割／離職率1.3%／自社サービス,未経験歓迎★年休125日／残業15H以内／年収350万円【SE・PG】 正社員,正社員,350万円
10,いなば食品株式会社 | 拡大期でのキャリア採用★賞与平均7ヶ月実績など充実の待遇あり,ちゅ～る・ライトツナなどの【企画営業】※20代活躍中 正社員,正社員,420万円～600万円
11,株式会社アークライン | ★年休120日以上★残業少なめ★完休2日（土日）★リモート強化中,充実の教育体制【開発エンジニア】★3ヶ月以上の自社研修あり♪ 正社員,正社員,300万円～400万円
12,株式会社ウェディングボックス | 【ふりそでMODE】感動幸福クリエイターによる幸せ創りのお手伝い,お客様の大切な日を彩る【振袖コーディネーター】★第二新卒歓迎 正社員,正社員,300万円～500万円
13,全国漁業協同組合連合会 | 【JF全漁連】コロナ対応テレワーク導入／賞与実績年5.16か月,"【企画営業】☆魚食の魅力を伝え、水産業の""これから""に貢献！ 正社員",正社員,400万円～500万円
14,株式会社テクノプロ | テクノプロ・R&D社／東証プライム市場 テクノプロ・グループ,【研究開発職(化学・バイオ分野)】第二新卒・ポスドク歓迎！ 正社員,正社員,350万円～600万円
15,ハラダ協同サービス株式会社 | 【JAのパートナー企業】手当充実/引っ越し費用全額負担,未経験歓迎!!【総合職(企画・運営)】★月9~11休★残業1日2ｈ以内 正社員,正社員,300万円～500万円
16,株式会社みなと銀行 | 【株式会社関西みらいフィナンシャルグループ】,【営業職(法人・リテール)】☆営業経験歓迎 ☆20・30代活躍中 正社員,正社員,300万円～600万円
17,株式会社野村総合研究所 | （NRI） 東証プライム上場★海外研修など豊富な研修制度あり,【総合職】WEBアプリ/システムコンサルタント/札幌募集 正社員,正社員,
18,中日本ハイウェイ・エンジニアリング名古屋株式会社 | NEXCO中日本グループ／年間休日130日以上／賞与6ヶ月分支給,高速道路の【技術系総合職(土木、建築、電気・通信、機械)】 正社員,正社員,300万円～600万円
19,株式会社ワールドスポーツ | 釣具のキャスティング★残業代全支給★手当充実★年休118日以上,"""好きを仕事に""【販売スタッフ】35歳以下の未経験＜積極採用＞ 正社員",正社員,
20,東京計器株式会社 | 【東証プライム上場】船舶湾港機器事業で業界をリードし続ける,★世界トップクラスシェア★船用機器【制御設計】年間休日126日 正社員,正社員,
21,株式会社ファーストスクエア | 全国トップクラス業績！だから賞与年2回★スピードキャリアUP！,【総合職(PR・企画・セールスプロモーションなど)】若手活躍中！ 正社員,正社員,350万円～500万円
22,"株式会社四国シジシー | 総年商4兆9,509億円を誇る「CGCグループ」/残業少なめ/転勤なし",地域の「食」を支える【営業企画】※土日休み ※転勤なし 正社員,正社員,
23,羽田空港サービス株式会社 | ANAのパートナー企業/引越費用補助＆住宅手当有/シャワー室完備,【グランドハンドリング】★業務領域拡大中★プライベートも充実 正社員,正社員,
24,東京計器株式会社 | 【東証プライム上場】船舶湾港機器事業で世界トップクラスシェア,世界屈指の技術力を手に★船用機器の【電気設計】年間休日126日 正社員,正社員,
25,株式会社野村総合研究所 | （NRI）東証プライム上場★海外研修など豊富な研修制度あり,【システムエンジニア(インフラ/ミドル/アプリ開発)】※福岡募集 正社員,正社員,
26,三井不動産商業マネジメント株式会社 | 【三井不動産グループ】★完全週休2日制★年間休日121日,総合職（「ららぽーと」など有名商業施設の企画・運営・管理） 正社員,正社員,
27,アクセンチュア株式会社 | 完全週休2日制(土日祝)で年間休日120日以上／充実の福利厚生アリ,福岡募集★未経験者も歓迎【 プロジェクト管理（PMO）】 正社員,正社員,400万円～1000万円
28,東京計器株式会社 | 【東証プライム上場】船舶湾港機器事業で世界トップクラスシェア,世界規模の市場で活躍★船用機器の【ソフト設計】年間休日126日 正社員,正社員,
29,株式会社やる気スイッチグループ | 19期連続増収★実働7.25ｈ★年休120★大阪府緊急雇用対策に賛同,スクールIE/WinBe【教室長】人生のスイッチが入る瞬間をあなたも 正社員,正社員,360万円～600万円
30,ネイチャーインサイト株式会社 | 土日祝休み・年休123日・転居/奨学金返済支援など福利厚生も充実,SASを扱う日本有数の希少人材が目指せる！【プログラマー】 正社員,正社員,
31,アクセンチュア株式会社 | 世界最大級の総合コンサルティング／ITサービス企業,【ITコンサルタント】※第二新卒/未経験者歓迎/関西も積極採用中 正社員,正社員,
32,ネイチャーインサイト株式会社 | 土日祝休み・年休123日・転居/奨学金返済支援など福利厚生も充実,未経験歓迎！業界でもレアな人材へ！【ITエンジニア】 正社員,正社員,
33,ダイレックス株式会社 | 【東証プライムグループ】#20種類以上の福利厚生あり #手当充実,【店舗スタッフ】★賞与年4.6ヶ月分 ★月8～9日休み ★未経験OK 正社員,正社員,300万円～400万円
34,医療法人湘美会 | 湘南美容クリニック*賞与年2回＋短期業績手当年4回*,【受付カウンセラー】*未経験歓迎*大卒月給26万円／残業ほぼなし 正社員,正社員,300万円～500万円
35,株式会社ボードルア | ★グロース上場企業★残業ほぼなし★完全週休2日(年休125日以上),経験ゼロから始めるオフィスワーク♪【IT事務】★100％未経験 正社員,正社員,300万円～700万円
36,"株式会社マミー・インターナショナル | 全国出張面接どこへでも会いに行きます♪家賃補助最大82,000円！",【保育士】東京・千葉・神奈川にて保育園を10園運営しています♪ 正社員,正社員,300万円～400万円
37,株式会社サザビーリーグ | アイビーカンパニー／Shake Shack、KIHACHI等を展開／ＷEB面接OK,Afternoon Teaの【カフェスタッフ】★月9日休み ★深夜営業なし 正社員,正社員,
38,株式会社ライフコーポレーション | プライム上場／賞与平均4.10ヶ月分【大阪府緊急雇用対策に賛同】,ライフの【総合職】★20～30代の若手が多数活躍中 ★地域別採用 正社員,正社員,300万円～400万円
39,株式会社修優舘 | あなたの経験と能力を満足のいく給与に変えてみませんか？,2人に1人が年収700万円超【講師・教室運営】※完全週休2日制も可 正社員,正社員,360万円～700万円
40,株式会社マイナビ | 就職や転職などのあらゆる人生の岐路を支えるサービスを提供,マイナビ転職の【広告営業】★全国の各拠点で積極採用中 正社員,正社員,380万円～570万円
41,株式会社ミルボン | 東証プライム上場のヘア化粧品メーカー：賞与実績年6.5ヶ月分,★未経験歓迎★ 美容室向けヘア化粧品メーカーの【営業職】 正社員,正社員,400万円～480万円
42,株式会社ミキモト | 業界を代表する世界的ハイジュエラー/年休121日/関西積極採用,【ジュエリーアドバイザー】~日本発のグローバルブランドで活躍~ 契約社員,契約社員,
43,株式会社星野リゾート・マネジメント,【ホテル・旅館の運営｜マネジメント候補生】第二新卒積極採用 正社員,正社員,370万円～450万円
44,ジョンソン・エンド・ジョンソン株式会社 | 完全週休2日制／福利厚生充実／20～30代女性活躍中！,【メディカル機器の提案営業(外科/整形外科領域)】★女性活躍中 正社員,正社員,550万円～800万円
45,東亜電気工業株式会社 | 創業以来75年 連続黒字経営のエレクトロニクス専門商社,電気・電子部品を既存取引先の法人に提案する【ルート営業】 正社員,正社員,
46,医療法人湘美会 | 湘南美容クリニック*残業5h以下*オフィス移転に伴う募集！,東京限定【問合せ対応スタッフ】駅から徒歩2分／新しいオフィス 正社員,正社員,300万円～400万円
47,学校法人藤川学園 | 自分の好きな科目が選べる！17時以降の授業はありません。,月給30万円以上を保証！【 学校職員（ 一般科目 ）】 契約社員,契約社員,360万円～500万円
48,アフラック収納サービス株式会社 | アフラックグループ／女性活躍推進法『えるぼし』最高評価を取得,アフラックグループで働く【事務系総合職】未経験・第二新卒歓迎 正社員,正社員,350万円～500万円
49,オリックス生命保険株式会社 | ◆賞与年4回/土日祝休み/退職金制度あり/充実の研修制度,20～30代活躍中！【提案営業】※固定月給25万円～/未経験歓迎！ 正社員,正社員,300万円～800万円
50,株式会社グローバルセンター | 転勤なし／コロナ禍でも好調のストックビジネス／社長も目指せる,【部門の責任者(経営幹部候補・マネージャー／リーダー)】 正社員,正社員,400万円～1200万円
51,東急リバブル株式会社 | ＜東急不動産ホールディングス(東証プライム上場)グループ＞,【法人営業】課題解決に向けたコンサル※ソリューション事業本部 正社員,正社員,400万円～600万円
52,グルンドフォスポンプ株式会社 | 世界トップレベル・ポンプメーカーの日本法人／年休126日以上,【購買スペシャリスト】◆土日祝休み◆賞与昨年度実績7カ月分 正社員,正社員,530万円～900万円
53,東リ株式会社 | プライム上場／圧倒的知名度＆シェア！あらゆる施設に東リ製品を,既存のお客様への【提案営業】★業界経験不問★20代活躍中 正社員,正社員,
54,株式会社近代設計 | 東証一部上場 E・Jホールディングス のグループ企業◆定着率抜群,【建設コンサルタント】残業月20h程度★賞与6ヶ月★完全週休2日 正社員,正社員,400万円～700万円
55,AZAPAエンジニアリング株式会社 | ＼6月25日(土)＊マイナビ転職フェア大阪に出展します／,未経験からチームで成長！Tier0.5へ挑戦【車両開発エンジニア】 正社員,正社員,
56,ポラス株式会社 | 《過去最高売上達成》15年連続住宅販売No.1！地域密着の安定企業,★賞与実績年6ヶ月分★【総合職(新築住宅営業・売買仲介営業)】 正社員,正社員,450万円～600万円
57,北都建設工業株式会社 | 2022年10月本社移転予定！賞与平均5.9ヶ月分◆年間休日129日,平均年収700万円【土木施工管理】※有資格者・未経験者歓迎 正社員,正社員,450万円～650万円
58,デリカSFホールディングス合同募集 | ヤマエグループ★セブンイレブンパートナーとして安定成長！,★初回配属地確約★【製造職】製造・品質管理・商品開発等 正社員,正社員,
59,グルンドフォスポンプ株式会社 | 世界トップレベル・ポンプメーカーの日本法人／年休126日以上,【製品技術・コンプライアンススペシャリスト】賞与実績7カ月分 正社員,正社員,530万円～900万円
60,株式会社識学 | 独自のマネジメント理論『識学』を展開／東証グロース市場上場,【組織コンサルタント】◆未経験歓迎◆週4日リモートワークOK 正社員,正社員,550万円～800万円
61,ＳＢＣパートナーズ税理士法人 | 《創業27年連続増収》更なる事業拡大に向けて邁進中！,企業の経営課題解決に取り組む【財務コンサルタント】※経験不問 正社員,正社員,350万円～500万円
62,ＡＧＣ株式会社 | プライム市場上場｜多彩な事業展開で安定感抜群｜有休取得率95％,【技能職】創業115年/世界シェアトップクラス/手当充実/未経験OK 正社員,正社員,
63,株式会社ゴールドファステート | 【固定月給30万円/大型連休年3回】【大阪府緊急雇用対策に賛同】,90％が未経験スタート！【コンサルティング営業】※テレアポ 正社員,正社員,600万円～2000万円
64,光伸株式会社 | 賞与最大年3回支給／完全週休2日制【大阪府緊急雇用対策に賛同】,専門商社の【総合職（営業・メンテナンス）】※年休120日以上 正社員,正社員,300万円～400万円
65,岡山機設株式会社 | 《公共性の高いインフラ企業》賞与年2回+決算賞与／福利厚生充実,長くキャリアを築ける！【 経理事務 】年休実質117日~（土日祝） 正社員,正社員,
66,株式会社ミギテック | やりたくない案件は断ってOK！これぞ真のエンジニアファースト！,フルリモート案件多彩！【ITエンジニア】★前職より給与UPを保証 正社員,正社員,450万円～1000万円
67,株式会社ＣＢコンサルティング | 20～30代が活躍中◆働きやすいフレックスタイム制◆年休124日,医療・福祉業界の課題を解決する【法人営業】★業界未経験歓迎 正社員,正社員,350万円～550万円
68,日軽パネルシステム株式会社 | 日本軽金属（株）100％出資／東証一部上場企業グループの安定性,圧倒的シェアを持つメーカーの【内装施工管理】★未経験OK！ 正社員,正社員,
69,株式会社ノジマ | ◆上場企業だからこその安定性◆正社員と変わらない待遇,★オープニングスタッフ募集中★【倉庫内作業スタッフ】 契約社員,契約社員,300万円～420万円
70,三井不動産レジデンシャル株式会社 | 三井不動産株式会社（東証プライム上場）グループ,【総合職】用地取得・企画開発・営業・海外事業等◆未経験歓迎 正社員,正社員,600万円～1150万円
71,学校法人藤川学園 | 完全週休2日制で残業少なめ☆仕事もプライベートも楽しめます！,"学生の"" 夢 ""を叶えるお手伝いをしませんか？【 広報・PR担当 】 契約社員",契約社員,
72,株式会社テクノ・クリエイト | 年休129日★残業ほぼなし★賞与年3回★フレックス制★リモートOK,多様な業界に携わる【マーケティング・リサーチャー】未経験歓迎 正社員,正社員,400万円～550万円
73,株式会社全教研 | 【学研グループ！北部九州に70拠点を展開】カジュアル面談を実施,★教員免許ナシでOK！未経験者も歓迎★【 講師（英語／数学）】 正社員,正社員,300万円～400万円
74,日軽パネルシステム株式会社 | 日本軽金属（株）100％出資／東証一部上場企業グループの安定性,未経験OK！業界で圧倒的シェアを持つパネルメーカーの【設計】 正社員,正社員,
75,株式会社TFDエステート | 【40年以上の実績を持つTFDグループ】,【賃貸管理】（賞与年2回／各種手当充実）※経験者歓迎 正社員,正社員,350万円～500万円
76,西武バス株式会社 | ★安定の【西武グループ】★借り上げ社宅制度 ★福利厚生が充実,【バス運行管理(事務員)】★未経験者歓迎★年休121日 正社員,正社員,400万円～450万円
77,株式会社NTTファシリティーズ | 建築×エネルギー×ICTで持続可能な未来をつくり、守りつづける,【データセンター空調設備技術者】海外製空調商材の販売拡大 正社員,正社員,500万円～800万円
78,株式会社リードホーム | 未経験入社9割！未経験者・特に歓迎！宅建4万・FP手当1万支給！,都心に特化！【不動産売買仲介】営業の半数以上が年収1100万円超 正社員,正社員,600万円～3000万円
79,フォーザウィン株式会社 | ＜完全週休2日／年間休日125日／有休取得100％／基本定時退社＞,【エンジニア総合職】★社会人経験必須★あなたの経験を高く評価 正社員,正社員,276万円～550万円
80,アプライド マテリアルズ ジャパン株式会社 | 売上世界No.1の半導体製造装置メーカーの日本法人,大分募集【カスタマーエンジニア】理系職経験者募集◆高卒以上 正社員,正社員,
81,東鉄工業株式会社 | プライム市場上場/JR東日本のパートナー企業/13年連続無借金経営,土木・建築等の【施工管理】◎平均年収851万円◎年間休日125日◎ 正社員,正社員,400万円～900万円
82,ポート株式会社 | 《東証グロース上場》完全週休2日☆年間休日120日☆福利厚生充実,学生向け就活メディアの【キャリアカウンセラー】★未経験歓迎 正社員,正社員,300万円～600万円
83,アプライド マテリアルズ ジャパン株式会社 | 売上世界No.1の半導体製造装置メーカーの日本法人,三重募集【カスタマーエンジニア】理系職経験者募集◆高卒以上 正社員,正社員,
84,株式会社スプリックス | ＜東証一部上場＞★賞与年2回（昨年度は通常の20％UP！）,森塾の【スクール運営(教室長候補)】◎Web面接実施 ◎男性活躍中 正社員,正社員,380万円～500万円
85,株式会社バローホールディングス | 設立から64年｜年休113日・週休2日…業界内でも働きやすさ抜群♪,未経験歓迎！笑顔があふれる職場♪バローの【 店舗スタッフ 】 正社員,正社員,250万円～500万円
86,ネットシステム株式会社 | 前職給与を最大限考慮／土日休み【大阪府緊急雇用対策に賛同】,多彩な案件を通じて成長できる！【ITエンジニア】残業少なめ 正社員,正社員,350万円～600万円
87,株式会社ジーネット | 【東証一部上場／フルサト・マルカHD】年間休日122日,日本のモノづくりを支える専門商社で活躍！【提案営業】未経験OK 正社員,正社員,400万円～540万円
88,株式会社ラクスパートナーズ | 上場企業グループ/9割が未経験スタート/年休120日以上/残業月10h,【ITエンジニア】★3ヶ月間の研修からスタート★未経験OK 正社員,正社員,350万円～500万円
89,グルンドフォスポンプ株式会社 | 世界トップレベル・ポンプメーカーの日本法人／年休126日以上,【ファイナンシャルコントローラー】土日祝休／賞与実績7カ月分 正社員,正社員,530万円～900万円
90,グルンドフォスポンプ株式会社 | 世界トップレベル・ポンプメーカーの日本法人／年休126日以上,【シニア・マーケティングスペシャリスト】賞与実績7カ月分 正社員,正社員,450万円～800万円
91,株式会社スリーエーコンサルティング | 9年連続売上は右肩上がりで成長中！残業ほぼなし！年間休日130日,ISO・Pマークに関する【コンサルティング】 正社員,正社員,300万円～400万円
92,アポプラスステーション株式会社 | 未経験入社率7割/直行直帰OK/MR認定試験合格率90％以上キープ,医薬品の営業【MR】《充実の研修制度★MR未経験歓迎★土日祝休》 正社員,正社員,
93,グルンドフォスポンプ株式会社 | 世界トップレベル・ポンプメーカーの日本法人／年休126日以上,【セールスエンジニア（機械・電気）】土日祝休み／賞与年3回 正社員,正社員,480万円～800万円
94,株式会社デイリー・インフォメーション中部 | ワークライフバランス推進認定企業／女性活躍推進認定企業,未経験から挑戦できる【 広告プランナー 】　★年間休日129日 正社員,正社員,300万円～450万円
95,株式会社ビッグモーター | 【5年連続買取台数No.1が活躍の舞台】★平均年収957万円以上,業界No.1の【自動車販売スタッフ】★経験/学歴/年齢不問 正社員,正社員,330万円～1500万円
96,アプライド マテリアルズ ジャパン株式会社 | 売上世界No.1の半導体製造装置メーカーの日本法人,長崎募集【カスタマーエンジニア】理系職経験者募集◆高卒以上 正社員,正社員,
97,株式会社ZEPE | 100％反響営業！無理のない働き方で、安定した収入を目指せる！,【ルート営業】未経験可！完全週休2日／高還元のインセンティブ 正社員,正社員,400万円～500万円
98,株式会社アイフリークモバイル | ◆東証JASDAQ上場の安定感◆,未経験から始める【IT事務】★残業ほぼゼロ★年間休日125日★ 正社員,正社員,250万円～700万円
99,株式会社ユートピア | ジョブチェンジ＆キャリアパスサポート企業◆残業月平均20h以下,【ITエンジニア】★第二新卒も大大大歓迎！★前給最大限考慮 正社員,正社員,300万円～800万円
100,イスコジャパン株式会社 | 88年間ずっと黒字経営の安定企業★昨年度の賞与実績…4.4ヶ月分,生活必需品である車のパーツを扱う専門商社の【 ルート営業 】 正社員,正社員,300万円～400万円
101,株式会社HYBE LABELS JAPAN | 土日祝休み＊年休125日以上＊完全フレックス制＊福利厚生充実,"韓流エンタメ業界の【A&R】★BTS,TXT,所属 正社員",正社員,300万円～1000万円
102,株式会社インテック | ◆未経験でも月給25万円～◆賞与年2回◆インセンティブ支給◎,人材サービスに関する【総合職(営業・人材コーディネーター)】 正社員,正社員,350万円～500万円
103,学校法人駿河台学園 | 【駿台予備学校】★完全週休2日★残業少なめ★正職員登用制度有,[募集拠点全国多数！]業界大手の駿台で働く【教務事務スタッフ】 契約社員,契約社員,
104,トランスコスモス株式会社 | 東証一部上場企業◆完全週休二日制◆育休取得後の復帰率97%,未経験歓迎！20代活躍中【ITサポート事務】年間休日122日以上♪ 正社員,正社員,320万円～700万円
